headline,pub_date,url,word_count,news_desk,source
"Deputy Fatally Shot Woman Over Pot of Hot Water, Records Show",2024-07-18T03:13:25+0000,https://www.nytimes.com/2024/07/17/us/sonya-massey-illinois-deputy-charged.html,971,Express,The New York Times
Julio Torres Is His Own Thing,2024-06-07T09:04:51+0000,https://www.nytimes.com/2024/06/07/arts/television/julio-torres-fantasmas.html,1238,Culture,The New York Times
The Mayor Was Indicted. New Yorkers Had Jokes.,2024-09-26T22:34:17+0000,https://www.nytimes.com/2024/09/26/nyregion/nyc-mayor-indictment-jokes.html,678,Metro,The New York Times
Trump Fully Devours the Republican Establishment,2024-02-16T10:04:29+0000,https://www.nytimes.com/2024/02/16/us/politics/trump-republican-party-establishment.html,1356,Politics,The New York Times
Canadian Ex-Intelligence Official Is Sentenced to 14 Years Over State Secrets,2024-02-08T01:17:01+0000,https://www.nytimes.com/2024/02/07/world/canada/sentence-state-secrets.html,529,Foreign,The New York Times
Where a Million Desperate People Are Finding Shelter in Lebanon,2024-10-16T09:12:03+0000,https://www.nytimes.com/2024/10/16/world/middleeast/israel-lebanon-displaced-hezbollah.html,1557,Foreign,The New York Times
Inflation Ticks Up in the Eurozone,2024-05-31T09:35:14+0000,https://www.nytimes.com/2024/05/31/business/eurozone-inflation-may.html,369,Business,The New York Times
"Welcome to Japan, Taylor Swift Fans. Please Remain Seated as You Cheer.",2024-02-09T12:18:32+0000,https://www.nytimes.com/2024/02/09/world/asia/taylor-swift-tokyo-japan.html,1125,Foreign,The New York Times
White House Calls Special Counsel Report on Biden Politically Motivated,2024-02-09T18:45:57+0000,https://www.nytimes.com/2024/02/09/us/politics/kamala-harris-biden-special-counsel.html,911,Washington,The New York Times
"Ad Nods to Taylor Swift and Football, Drawing Cheers and Criticism",2024-02-12T00:30:32+0000,https://www.nytimes.com/2024/02/11/business/cetaphil-taylor-swift-commercial.html,718,Business,The New York Times
Donald Trump Embraces ‘Love’,2024-09-25T12:00:08+0000,https://www.nytimes.com/2024/09/25/style/donald-trump-embraces-love.html,1136,Styles,The New York Times
Google’s Antitrust Defeat Opens the Door to Lawsuit From Yelp,2024-08-28T20:55:43+0000,https://www.nytimes.com/2024/08/28/technology/google-yelp-lawsuit.html,1077,Business,The New York Times
Can You Tell Which Short Story ChatGPT Wrote?,2024-08-28T09:05:58+0000,https://www.nytimes.com/2024/08/28/opinion/curtis-sittenfeld-chatgpt-summer-beach-story.html,2910,OpEd,The New York Times
Video and Airplane Sketch Raise New Questions About Saudi Ties to 9/11,2024-08-09T19:24:00+0000,https://www.nytimes.com/2024/08/09/nyregion/sept-11-saudi-ties.html,995,Metro,The New York Times
